{
	"models": {
		"ur5e": {
			"kind": "robot",
			"links": {
				"base": {
					"parent": "ROOT",
					"pose": { "xyz": [ 0, 0, 0 ], "qxyzw": [ 0, 0, 0, 1 ] },
					"parts": [ "baseCollision" ]
				},
				"shoulder": {
					"parent": "base",
					"pose": { "dh": { "theta": { "joint": "base" }, "a": 0, "s": 0.1625, "alpha": 1.57079632679 } }
				},
				"upperArm": {
					"parent": "shoulder",
					"pose": { "dh": { "theta": { "joint": "shoulder" }, "a": -0.425, "s": 0, "alpha": 0 } },
					"parts": [ "upperArmCollision" ]
				},
				"forearm": {
					"parent": "upperArm",
					"pose": { "dh": { "theta": { "joint": "elbow" }, "a": -0.3922, "s": 0, "alpha": 0 } },
					"parts": [ "forearmCollision" ]
				},
				"wrist1": {
					"parent": "forearm",
					"pose": { "dh": { "theta": { "joint": "wrist1" }, "a": 0, "s": 0.1333, "alpha": 1.57079632679 } },
					"parts": [ "wrist1Collision" ]
				},
				"wrist2": {
					"parent": "wrist1",
					"pose": { "dh": { "theta": { "joint": "wrist2" }, "a": 0, "s": 0.0997, "alpha": -1.57079632679 } },
					"parts": [ "wrist2Collision" ]
				},
				"wrist3": {
					"parent": "wrist2",
					"pose": { "dh": { "theta": { "joint": "wrist3" }, "a": 0, "s": 0.0996, "alpha": 0 } },
					"parts": [ "wrist3Collision" ]
				}
			},
			"partModels": {
				"baseCollision": { "shapes": {
						"baseShape": {
							"kind": "orangeNet",
							"points": [ [ 0, 0, 0 ], [ 0, 0, 0.18 ] ],
							"radius": 0.078,
							"margin": 0.01
						}
					} },
				"upperArmCollision": { "shapes": {
						"shoulderShape": {
							"kind": "orangeNet",
							"points": [ [ 0.425, 0, 0 ], [ 0.417, 0, 0.16 ] ],
							"radius": 0.07,
							"margin": 0.01
						},
						"upperArmShape": {
							"kind": "orangeNet",
							"points": [ [ 0.425, 0, 0.138 ], [ 0, 0, 0.138 ] ],
							"radius": 0.07,
							"margin": 0.01
						},
						"elbowShape": {
							"kind": "orangeNet",
							"points": [ [ 0.008, 0, 0.16 ], [ 0, 0, 0.03 ] ],
							"radius": 0.07,
							"margin": 0.01
						}
					} },
				"forearmCollision": { "shapes": {
						"forearmShape": {
							"kind": "orangeNet",
							"points": [ [ 0.367, 0, 0.007 ], [ 0, 0, 0.007 ] ],
							"radius": 0.05,
							"margin": 0.01
						},
						"forearmToWristShape": {
							"kind": "orangeNet",
							"points": [ [ 0, 0, -0.023 ], [ 0, 0, 0.133 ] ],
							"radius": 0.043,
							"margin": 0.01
						}
					} },
				"wrist1Collision": { "shapes": {
						"wrist1Shape": {
							"kind": "orangeNet",
							"points": [ [ 0, -0.002, -0.028 ], [ 0, 0, 0.1 ] ],
							"radius": 0.043,
							"margin": 0.01
						}
					} },
				"wrist2Collision": { "shapes": {
						"wrist2Shape": {
							"kind": "orangeNet",
							"points": [ [ 0, 0.002, -0.024 ], [ 0, 0, 0.027 ] ],
							"radius": 0.045,
							"margin": 0.01
						}
					} },
				"wrist3Collision": { "shapes": {
						"wrist3Shape": {
							"kind": "orangeNet",
							"points": [ [ 0, 0, -0.031 ] ],
							"radius": 0.045,
							"margin": 0.01
						}
					} }
			},

			"joints": {
				"base": {
					"minValue": -3.14159265359,
					"maxValue": 3.14159265359,
					"maxVelocity": 1,
					"maxAcceleration": 1,
					"maxDeceleration": 5,
					"maxJerk": 10,
					"maxEffort": 10
				},
				"shoulder": {
					"minValue": -3.14159265359,
					"maxValue": 3.14159265359,
					"maxVelocity": 1,
					"maxAcceleration": 1,
					"maxDeceleration": 5,
					"maxJerk": 10,
					"maxEffort": 10
				},
				"elbow": {
					"minValue": -3.14159265359,
					"maxValue": 3.14159265359,
					"maxVelocity": 1,
					"maxAcceleration": 1,
					"maxDeceleration": 5,
					"maxJerk": 10,
					"maxEffort": 10
				},
				"wrist1": {
					"minValue": -3.14159265359,
					"maxValue": 3.14159265359,
					"maxVelocity": 1,
					"maxAcceleration": 1,
					"maxDeceleration": 5,
					"maxJerk": 10,
					"maxEffort": 10
				},
				"wrist2": {
					"minValue": -3.14159265359,
					"maxValue": 3.14159265359,
					"maxVelocity": 1,
					"maxAcceleration": 1,
					"maxDeceleration": 5,
					"maxJerk": 10,
					"maxEffort": 10
				},
				"wrist3": {
					"minValue": -3.14159265359,
					"maxValue": 3.14159265359,
					"maxVelocity": 1,
					"maxAcceleration": 1,
					"maxDeceleration": 5,
					"maxJerk": 10,
					"maxEffort": 10
				}
			},
			"collisionIgnoreGroups": {
				"shoulder": [ "base", "upperArm" ],
				"armParts": [ "upperArm", "forearm" ],
				"wrist1": [ "forearm", "wrist1", "wrist2" ],
				"wrist2": [ "wrist1", "wrist2", "wrist3" ]
			},
			"constraints": { },
			"visuals": "../../models/ur5e.glb"
		},

		"fundament": {
			"kind": "rigidBody",
			"shapes": {
				"groundShape": {
					"kind": "box",
					"pose": { "xyz": [ 0, 0, -0.0751 ], "qxyzw": [ 0, 0, 0, 1 ] },
					"size": [ 2.201, 2.201, 0.152 ],
					"margin": 0.01
				}
			},
			"visuals": "../../models/fundament.glb"
		},

		"pillar": {
			"kind": "rigidBody",
			"shapes": {
				"pillarShape": {
					"kind": "cylinder",
					"center": [ 0, 0, 0.5 ],
					"radius": 0.1,
					"axis": "z",
					"height": 1.0001,
					"margin": 0.01
				}
			},
			"visuals": "../../models/column.glb"
		},

		"cube": {
			"kind": "rigidBody",
			"shapes": {
				"cubeShape": {
					"kind": "box",
					"pose": { "xyz": [ 0, 0, 0 ], "qxyzw": [ 0, 0, 0, 1 ] },
					"size": [ 0.1155, 0.1155, 0.1155 ],
					"margin": 0.01
				}
			},
			"visuals": "../../models/cube.glb"
		},

		"sphere": {
			"kind": "rigidBody",
			"shapes": {
				"sphereShape": {
					"kind": "sphere",
					"center": [ 0, 0, 0 ],
					"radius": 0.1,
					"margin": 0.01
				}
			},
			"visuals": "../../models/sphere.glb"
		},

		"cylinder": {
			"kind": "rigidBody",
			"shapes": {
				"cylinderShape": {
					"kind": "cylinder",
					"center": [ 0, 0, 0 ],
					"radius": 0.0708,
					"axis": "z",
					"height": 0.1415,
					"margin": 0.01
				}
			},
			"visuals": "../../models/cylinder.glb"
		},

		"ico": {
			"kind": "rigidBody",
			"shapes": {
				"cylinderShape": {
					"kind": "orangeNet",
					"points": [
						[ 0.000000, 0.000000, -0.100000 ],
						[ 0.072360, -0.052572, -0.044722 ],
						[ -0.027639, -0.085064, -0.044722 ],
						[ -0.089442, 0.000000, -0.044722 ],
						[ -0.027639, 0.085064, -0.044722 ],
						[ 0.072360, 0.052572, -0.044722 ],
						[ 0.027639, -0.085064, 0.044722 ],
						[ -0.072360, -0.052572, 0.044722 ],
						[ -0.072360, 0.052572, 0.044722 ],
						[ 0.027639, 0.085064, 0.044722 ],
						[ 0.089442, 0.000000, 0.044722 ],
						[ 0.000000, 0.000000, 0.100000 ]
					],
					"radius": 0.0001,
					"margin": 0.01
				}
			},
			"visuals": "../../models/ico.glb"
		}
	},

	"objects": {
		"robot1": {
			"model": "ur5e",
			"parent": "WORLD",
			"pose": { "xyz": [ 0, 0, 0 ], "qxyzw": [ 0, 0, 0, 1 ] },
			"jointValues": {
				"base": 3.14,
				"shoulder": -0.6,
				"elbow": 1.0,
				"wrist1": 0.4,
				"wrist2": 0.5,
				"wrist3": 0.6
			}
		},

		"fundament": {
			"parent": "WORLD",
			"pose": { "xyz": [ 0, 0, 0 ], "qxyzw": [ 0, 0, 0, 1 ] },
			"model": "fundament"
		},
		"pillar1": {
			"parent": "WORLD",
			"pose": { "xyz": [ -0.5, -0.5, 0 ], "qxyzw": [ 0, 0, 0, 1 ] },
			"model": "pillar"
		},
		"cube": {
			"parent": "pillar1",
			"pose": { "xyz": [ 0, 0, 1.1 ], "qxyzw": [ 0.424668, 0.175903, -0.33986, 0.820494 ] },
			"model": "cube"
		},
		"pillar2": {
			"parent": "WORLD",
			"pose": { "xyz": [ -0.5, 0.5, 0 ], "qxyzw": [ 0, 0, 0, 1 ] },
			"model": "pillar"
		},
		"sphere": {
			"parent": "pillar2",
			"pose": { "xyz": [ 0, 0, 1.1 ], "qxyzw": [ 0, 0, 0, 1 ] },
			"model": "sphere"
		},
		"pillar3": {
			"parent": "WORLD",
			"pose": { "xyz": [ 0.5, -0.5, 0 ], "qxyzw": [ 0, 0, 0, 1 ] },
			"model": "pillar"
		},
		"cylinder": {
			"parent": "pillar3",
			"pose": { "xyz": [ 0, 0, 1.1 ], "qxyzw": [ 0, 0.382683, 0, 0.92388 ] },
			"model": "cylinder"
		},
		"pillar4": {
			"parent": "WORLD",
			"pose": { "xyz": [ 0.5, 0.5, 0 ], "qxyzw": [ 0, 0, 0, 1 ] },
			"model": "pillar"
		},
		"ico": {
			"parent": "pillar4",
			"pose": { "xyz": [ 0, 0, 1.1 ], "qxyzw": [ 0, 0, 0, 1 ] },
			"model": "ico"
		}
	},

	"collisionIgnoreGroups": {
		"environment": [ "fundament", "pillar1", "cube", "pillar2", "sphere", "pillar3", "cylinder", "pillar4", "ico" ],
		"mounting": [ "fundament", "robot1.base" ]
	},

	"trajectories": {
		"wave": {
			"controlPoints": [
				{ "f": [ 0, -1, 1.6, -0.6, 0.2, 0.2 ], "df": [ 0, 0, 0, 0, 0, 0 ] },
				{ "f": [ 0, -1.5, 1.6, -0.6, 0.2, 0.2 ], "df": [ 0, 0, 0, 0, 0, 0 ] }
			]
		}
	}

}
